,task_name
1599,"identify or recommend integrated weed and pest management (ipm) strategies, such as resistant plants, cultural or behavioral controls, soil amendments, insects, natural enemies, barriers, or pesticides."
1600,identify or separate waste products or materials for recycling or reuse.
1601,"identify plants as well as problems such as diseases, weeds, and insect pests."
1602,"identify potential clients, using advertising campaigns, mailing lists, or personal contacts."
1603,identify potential for loss and develop strategies to eliminate it.
1604,"identify prospective customers by using business directories, following leads from existing clients, participating in organizations and clubs, and attending trade shows and conferences."
1605,"identify psychological, emotional, or behavioral issues and diagnose disorders, using information obtained from interviews, tests, records, and reference materials."
1606,"identify relationships and trends in data, as well as any factors that could affect the results of research."
1607,"identify risks for natural disasters, such as mudslides, earthquakes, or volcanic eruptions."
1608,identify solutions to on-site technical design problems involving electrical systems equipment.
1609,"identify spatial coordinates, using remote sensing and global positioning system (gps) data."
1610,"identify staff vacancies and recruit, interview and select applicants."
1611,"identify stations, and introduce or close shows, using memorized or read scripts, and/or ad-libs."
1612,identify sustainable alternatives to industrial or waste management practices.
1613,"identify system data, hardware, or software components required to meet user needs."
1614,"identify target markets for designs, looking at factors such as age, gender, and socioeconomic status."
1615,"identify the causes of networking problems, using diagnostic testing software and equipment."
1616,"identify the etiology, pathogenesis, morphological change, and clinical significance of diseases."
1617,"identify tissue structures or cell components to be used in the diagnosis, prevention, or treatment of diseases."
1618,identify transaction mistakes when debits and credits do not balance.
1619,"identify, collect, record or analyze data that are relevant to the nursing care of patients."
1620,"identify, compile, abstract, and code patient data, using standard classification systems."
1621,"identify, develop, or evaluate marketing strategy, based on knowledge of establishment objectives, market characteristics, and cost and markup factors."
1622,"identify, evaluate and recommend hardware or software technologies to achieve desired database performance."
1623,"identify, investigate, or resolve security breaches."
1624,"identify, monitor, or treat pregnancy-related problems such as hypertension, gestational diabetes, pre-term labor, and retarded fetal growth."
1625,"identify, procure, or develop test equipment, instrumentation, or facilities for characterization of microelectromechanical systems (mems) applications."
1626,"identify, review, or select vendors or consultants to meet project needs."
1627,"identify, standardize, and communicate levels of access and security."
1628,"identify, track, or maintain metrics for trading system operations."
1629,"implement and provide technical support for voice services and equipment, such as private branch exchange, voice mail system, and telecom system."
1630,"implement business rules via stored procedures, middleware, or other technologies."
1631,"implement changes to machine programs and enter new specifications, using computers."
1632,"implement controls to provide security for operating systems, software, and data."
1633,"implement electronic document processing, retrieval, and distribution systems in collaboration with other information technology specialists."
1634,implement financial planning recommendations or refer clients to someone who can assist them with plan implementation.
1635,"implement grant-funded projects, monitoring and reporting progress in accordance with sponsoring agency requirements."
1636,implement or monitor processes to reduce property or financial losses.
1637,"implement security practices to preserve assets, minimize liabilities, or ensure customer privacy, using parallel servers, hardware redundancy, fail-safe technology, information encryption, or firewalls."
1638,"implement web site security measures, such as firewalls or message encryption."
1639,"import text and art elements, such as electronic clip art or electronic files from photographs that have been scanned or produced with a digital camera, using computer software."
1640,"improve search-related activities through ongoing analysis, experimentation, or optimization tests, using a/b or multivariate methods."
1641,improve user interfaces to bioinformatics software and databases.
1642,"induce changes in composition of substances by introducing heat, light, energy, or chemical catalysts for quantitative or qualitative analysis."
1643,inform and advise concerned parties regarding fluctuations or securities transactions affecting plans or accounts.
1644,inform and educate the public about fire prevention.
1645,"inform and respond to public regarding wildlife and conservation issues, such as plant identification, hunting ordinances, and nuisance wildlife."
1646,"inform businesses, community groups, and governmental agencies about educational needs, available programs, and program policies."
1647,"inform clients of essential travel information, such as travel times, transportation connections, and medical and visa requirements."
1648,"inform clients of factors such as shipping options, timelines, transfers, or regulations affecting shipments."
1649,inform company employees or other interested parties of environmental issues.
1650,inform customers by mail or telephone of additional steps they need to take to obtain licenses.
1651,"inform customers by mail or telephone of order information, such as unit prices, shipping dates, and any anticipated delays."
1652,inform individuals and groups about the financial assistance available to college or university students.
1653,"inform individuals and groups of pollution control regulations and inspection findings, and explain how problems can be corrected."
1654,"inform investment decisions by analyzing financial information to forecast business, industry, or economic conditions."
1655,"inform job applicants of details such as duties and responsibilities, compensation, benefits, schedules, working conditions, or promotion opportunities."
1656,inform job applicants of their acceptance or rejection of employment.
1657,"inform other traders, managers, or customers of market conditions, including volume, price, competition, or dynamics."
1658,inform patients or caregivers about study aspects and outcomes to be expected.
1659,inform users of audio and videotaping service policies and procedures.
1660,"inform web site users of problems, problem resolutions or application changes and updates."
1661,inform workers about interests or special needs of specific groups.
1662,initiate market research studies or analyze their findings.
1663,"initiate, facilitate, and moderate classroom discussions."
1664,"inspect and test electrical or electronic systems to locate and diagnose malfunctions, using visual inspections and testing instruments such as oscilloscopes and voltmeters."
1665,"inspect and test electrical systems and equipment to locate and diagnose malfunctions, using visual inspections, testing devices, and computer software."
1666,inspect and verify dimensions and clearances of parts to ensure conformance to factory specifications.
1667,"inspect cargo, baggage, and personal articles entering or leaving u.s. for compliance with revenue laws and u.s. customs regulations."
1668,inspect event facilities to ensure that they conform to customer requirements.
1669,inspect food products and processing procedures to determine whether products are safe to eat.
1670,"inspect individual parts, assemblies, or installations, using measuring instruments, such as calipers, scales, or micrometers."
1671,inspect industrial or municipal facilities or programs to evaluate operational effectiveness or ensure compliance with environmental regulations.
1672,"inspect layouts and advertising copy and edit scripts, audio and video tapes, and other promotional material for adherence to specifications."
1673,"inspect or monitor energy systems, including heating, ventilating, and air conditioning (hvac) or daylighting systems to determine energy use or potential energy savings."
1674,inspect project sites to monitor progress and ensure conformance to design specifications and safety or sanitation standards.
1675,"inspect structures to assess material or equipment needs, to establish the sequence of pipe installations, or to plan installation around obstructions such as electrical wiring."
1676,"inspect, weigh, and measure mounted or unmounted lenses after completion to verify alignment and conformance to specifications, using precision instruments."
1677,install and configure hypertext transfer protocol (http) servers and associated operating systems.
1678,"install and configure new equipment, including operating software or peripheral equipment."
1679,"install and perform minor repairs to hardware, software, or peripheral equipment, following design or installation specifications."
1680,install bookkeeping systems and resolve system problems.
1681,"install or configure web server software or hardware to ensure that directory structure is well-defined, logical, secure, and that files are named properly."
1682,"install updated software, and programs that maintain existing software or provide requested features such as time-correlated call routing."
1683,"install, adjust, and operate electronic equipment to record, edit, and transmit radio and television programs, motion pictures, video conferencing, or multimedia presentations."
1684,"install, service, and repair electronic equipment or instruments such as televisions, radios, and videocassette recorders."
1685,instruct customers on the safe and proper use of equipment.
1686,"instruct in use of voice, video, and data communications systems."
1687,instruct individuals and groups on ways to preserve health and prevent disease.
1688,"instruct individuals in career development techniques such as job search and application strategies, resume writing, and interview skills."
1689,"instruct individuals or groups in sports rules, game strategies, and performance principles, such as specific ways of moving the body, hands, or feet, to achieve desired results."
1690,"instruct individuals or groups in the use of art media, such as paint, clay, or yarn."
1691,"instruct others in program methods, procedures, or functions."
1692,instruct others in the selection and use of bioinformatics tools.
1693,instruct participants in maintaining exertion levels to maximize benefits from exercise routines.
1694,"instruct patrons on how to use reference sources, card catalogs, and automated information systems."
1695,"instruct students in the knowledge and skills required in a specific occupation or occupational field, using a systematic plan of lectures, discussions, audio-visual presentations, and laboratory, shop and field studies."
1696,"instruct students individually and in groups, using various teaching methods such as lectures, discussions, and demonstrations."
1697,"instruct students individually and in groups, using various teaching methods, such as lectures, discussions, and demonstrations."
1698,"instruct through lectures, discussions, and demonstrations in one or more subjects, such as english, mathematics, or social studies."
1699,instruct undergraduate and graduate students within the areas of cellular or molecular biology.
1700,"instruct users in the selection, use, and design of audio-visual materials and assist them in the preparation of instructional materials and the rehearsal of presentations."
1701,insulate shells and cabinets of systems.
1702,"integrate and develop visual elements, such as line, space, mass, color, and perspective, to produce desired effects, such as the illustration of ideas, emotions, or moods."
1703,integrate electrical systems with renewable energy systems to improve overall efficiency.
1704,"integrate environmental information into product or company marketing strategies, policies, or activities."
1705,"integrate nanotechnology with antimicrobial properties into products, such as household or medical appliances, to reduce the development of bacteria or other microbes."
1706,integrate online retailing strategy with physical or catalogue retailing operations.
1707,"integrate software or hardware components, using computer, microprocessor, or control architecture."
1708,"interact with clients to assist them in gaining insight, defining goals, and planning action to achieve effective personal, social, educational, and vocational development and adjustment."
1709,"interact with the public to answer traffic-related questions, respond to complaints or requests, or discuss traffic control ordinances, plans, policies, or procedures."
1710,"interpret and analyze policies, public issues, legislation, or the operations of governments, businesses, and organizations."
1711,interpret and communicate work procedures and company policies to staff.
1712,"interpret and explain human resources policies, procedures, laws, standards, or regulations."
1713,"interpret and explain information such as eligibility requirements, application details, payment methods, and applicants' legal rights."
1714,"interpret and explain laws and regulations to travelers, prospective immigrants, shippers, and manufacturers."
1715,"interpret and explain plans and contract terms to representatives of the owner or developer, including administrative staff, workers, or clients."
1716,"interpret and explain policies, rules, regulations, or laws to organizations, government or corporate officials, or individuals."
1717,interpret chemical reactions visible through sight glasses or on television monitors and review laboratory test reports for process adjustments.
1718,interpret civil rights laws and equal opportunity regulations for individuals or employers.
1719,interpret clinical or diagnostic test results.
1720,interpret contractual agreements for employers and employees engaged in collective bargaining or other labor relations processes.
1721,"interpret data on logistics elements, such as availability, maintainability, reliability, supply chain management, strategic sourcing or distribution, supplier management, or transportation."
1722,"interpret data on price, yield, stability, future investment-risk trends, economic influences, and other factors affecting investment programs."
1723,"interpret data, reports, maps, photographs, or charts to predict long- or short-range weather conditions, using computer models and knowledge of climate theory, physics, and mathematics."
1724,interpret diagnostic or laboratory tests such as electrocardiograms (ekgs) and renal functioning tests.
1725,interpret diagnostic test results for deviations from normal.
1726,interpret diagnostic test results to make appropriate differential diagnoses.
1727,"interpret engineering drawings, schematic diagrams, or formulas for management or engineering staff."
1728,"interpret engineering drawings, sketches, or diagrams."
1729,"interpret engineering sketches, specifications, or drawings."
1730,interpret exercise program participant data to evaluate progress or identify needed program changes.
1731,interpret flight test data to diagnose malfunctions and systemic performance problems.
1732,interpret government regulations and applicable codes to ensure compliance.
1733,interpret images using computer-aided detection or diagnosis systems.
1734,interpret imaging data and confer with other medical specialists to formulate diagnoses.
1735,interpret indicators to ascertain the overall health of an environment.
1736,interpret instrument readings to ascertain the depth of obstruction.
1737,interpret insurance data or health reimbursement account (hra) data to develop programs that address specific needs of target populations.
1738,interpret laboratory results and communicate findings to patients or physicians.
1739,"interpret laws, rulings and regulations for individuals and businesses."
1740,"interpret or modify music, applying knowledge of harmony, melody, rhythm, and voice production to individualize presentations and maintain audience interest."
1741,interpret or transcribe classroom materials into braille or sign language.
1742,interpret protocols and advise treating physicians on appropriate dosage modifications or treatment calculations based on patient characteristics.
1743,interpret regulatory rules or rule changes and ensure that they are communicated through corporate policies and procedures.
1744,"interpret religious education activities to the public through speaking, leading discussions, or writing articles for local or national publications."
1745,interpret results of financial analysis procedures.
1746,interpret stage-set diagrams to determine stage layouts and supervise placement of equipment and scenery.
1747,"interpret test results and prepare psychological reports for teachers, administrators, and parents."
1748,"interpret the results of neuroimaging studies such as magnetic resonance imaging (mri), single photon emission computed tomography (spect), and positron emission tomography (pet) scans."
1749,interpret the results of standardized tests to determine students' strengths and areas of need.
1750,"interpret, translate, or provide cultural mediation related to health services or information for community members."
1751,interview applicants and request specified information for loan applications.
1752,interview clients and take their calls to provide customer service and obtain information on claims.
1753,"interview individuals, and research public databases in order to obtain information."
1754,"interview job applicants to obtain information on work history, training, education, or job skills."
1755,"interview patients to obtain information such as complaints, symptoms, medical histories, and family histories."
1756,"interview prospective clients to obtain data about their financial resources and needs, the physical condition of the person or property to be insured, and to discuss any existing coverage."
1757,interview subject matter experts or conduct other research to develop instructional content.
1758,"invent names for products and write the slogans that appear on packaging, brochures and other promotional material."
1759,investigate available investment opportunities to determine compatibility with client financial plans.
1760,"investigate characteristics such as cost, performance, or process capability of potential microelectromechanical systems (mems) device designs, using simulation or modeling software."
1761,investigate customer or public complaints to determine the nature and extent of problems.
1762,investigate or test specific construction project materials to determine compliance to specifications or standards.
1763,"investigate products or markets to determine areas for opportunity or viability for merchandising specific products, using online or offline sources."
1764,"investigate the nature, composition, or expression of genes or research how genetic engineering can impact these processes."
1765,investigate the relationship between organisms and disease including the control of epidemics and the effects of antibiotics on microorganisms.
1766,"investigate theoretical or conceptual issues, such as the human design considerations of lunar landers or habitats."
1767,"investigate whether networks, workstations, the central processing unit of the system, or peripheral equipment are responding to a program's instructions."
1768,issue and record adjustments to pay related to previous errors or retroactive increases.
1769,"keep abreast of changes in industry practices and emerging telecommunications technology by reviewing current literature, talking with colleagues, participating in educational programs, attending meetings or workshops, or participating in professional organizations or conferences."
1770,keep abreast of developments and changes in the nuclear field by reading technical journals or by independent study and research.
1771,"keep abreast of developments and technological advances in the mathematical field by reading current literature, talking with colleagues, and participating in professional conferences."
1772,"keep abreast of developments in the field by reading current literature, talking with colleagues, and participating in professional conferences."
1773,"keep abreast of developments in the field by reading current literature, talking with colleagues, and participating in professional organizations and conferences."
1774,"keep abreast of developments in the field by reading current literature, talking with colleagues, giving presentations at conferences, and serving on committees in professional associations."
1775,"keep abreast of new biochemistries, instrumentation, or software by reading scientific literature and attending professional conferences."
1776,"keep abreast of regulatory processes and payer systems such as medicare, medicaid, managed care, and private sources."
1777,"keep informed about economic or legal issues involved in zoning codes, building codes, or environmental regulations."
1778,keep informed about trends in education and subject matter specialties.
1779,keep informed of industry trends and deals.
1780,keep informed of new products and developments.
1781,"keep informed on industry news and trends, products, services, competitors, relevant information about legacy, existing, and emerging technologies, and the latest product-line developments."
1782,"keep informed regarding pending industry changes, trends, and best practices and assess the potential impact of these changes on organizational processes."
1783,"keep records and prepare reports detailing findings, investigative methods, and laboratory techniques."
1784,keep records of the quantities of food used.
1785,key and program specified commands and engineering specifications into computer system to change functions and test final layout.
1786,key in processing instructions to program electronic equipment.
1787,lead tours and answer visitors' questions about the exhibits.
1788,learn about characters in scripts and their relationships to each other to develop role interpretations.
1789,learn about competitors' products or consumers' interests or concerns to answer questions or provide more complete information.
1790,"learn about new developments in counseling by reading professional literature, attending courses and seminars, or establishing and maintaining contact with other social service agencies."
1791,listen and provide emotional support and encouragement to psychiatric patients.
1792,"listen to and resolve customer complaints regarding services, products, or personnel."
1793,listen to and resolve customers' complaints regarding products or services.
1794,"listen to engines, examine vehicle frames, or confer with customers to determine nature and extent of malfunction or damage."
1795,"locate and distribute resources, such as periodicals or curricula, to enhance the effectiveness of educational programs."
1796,"locate and document information regarding the next of kin, including their relationship to the deceased and the status of notification attempts."
1797,"locate and notify customers of delinquent accounts by mail, telephone, or personal visits to solicit payment."
1798,locate and remove or repair circuit defects such as blown fuses or malfunctioning transistors.
1799,"locate and review research articles or environmental, historical, or technical reports."
1800,locate guests to appear on talk or interview shows.
1801,"locate library materials for patrons, including books, periodicals, tape cassettes, braille volumes, and pictures."
1802,locate unusual or unique information in response to specific requests.
1803,maintain a clinical practice.
1804,maintain a current file of examination protocols.
1805,"maintain access to, and security of, highly sensitive materials."
1806,"maintain and administer computer networks and related computing environments including computer hardware, systems software, applications software, and all configurations."
1807,"maintain and review account records, updating and recategorizing them according to status changes."
1808,"maintain and update human resources documents, such as organizational charts, employee handbooks or directories, or performance evaluation forms."
1809,"maintain archive of images, photos, or previous work products."
1810,"maintain awareness of advances in medicine, computerized diagnostic and treatment equipment, data processing technology, government regulations, health insurance changes, and financing options."
1811,"maintain awareness of current income tax regulations, local zoning, building and tax laws, and growth possibilities of the area where a property is located."
1812,maintain awareness of new and emerging computational methods and technologies.
1813,maintain client databases.
1814,maintain computer equipment used in instruction.
1815,"maintain contact with kitchen staff, management, serving staff, and customers to ensure that dining details are handled properly and customers' concerns are addressed."
1816,maintain controlled drug inventory and related log books.
1817,maintain current knowledge of credit regulations.
1818,"maintain current knowledge of equal employment opportunity (eeo) and affirmative action guidelines and laws, such as the americans with disabilities act (ada)."
