,task_name
907,design research projects that apply valid scientific techniques and use information obtained from baselines or historical data to structure uncompromised and efficient analyses.
908,"design research studies in collaboration with physicians, life scientists, or other professionals."
909,"design robotic systems, such as automatic vehicle control, autonomous vehicles, advanced displays, advanced sensing, robotic platforms, computer vision, or telematics systems."
910,"design security policies, programs, or practices to ensure adequate security relating to issues such as protection of assets, alarm response, and access card use."
911,"design silver articles, such as jewelry and serving pieces."
912,"design software to control robotic systems for applications, such as military defense or manufacturing."
913,"design specialized or customized equipment, machines, or structures."
914,design transportation surveys to identify areas of public concern.
915,"design transportation systems or structures using sustainable materials or products, such as porous pavement or bioretention structures."
916,"design water run-off collection networks, water supply channels, or water supply system networks."
917,design water storage tanks or other water storage facilities.
918,"design, analyze, and decipher encryption systems designed to transmit military, political, financial, or law-enforcement-related information in code."
919,"design, build, or maintain web sites, using authoring or scripting languages, content creation tools, management tools, and digital media."
920,"design, build, or operate equipment configuration prototypes, including network hardware, software, servers, or server operation systems."
921,"design, configure, and test computer hardware, networking software and operating system software."
922,"design, customize, and maintain databases, web pages, and local area networks."
923,"design, develop and modify software systems, using scientific analysis and mathematical models to predict and measure outcome and consequences of design."
924,"design, develop, or implement control circuits or algorithms for electromechanical or pneumatic devices or systems."
925,"design, develop, select, test, implement, and evaluate new or modified informatics solutions, data structures, and decision-support mechanisms to support patients, health care professionals, and their information management and human-computer and human-technology interactions within health care contexts."
926,"design, evaluate and modify benefits policies to ensure that programs are current, competitive and in compliance with legal requirements."
927,"design, evaluate, recommend, and approve changes of forms and reports."
928,"design, implement, or evaluate health service delivery systems to improve the health of targeted populations."
929,"design, implement, or operate comprehensive data warehouse systems to balance optimization of data access with batch loading and resource utilization factors, according to customer requirements."
930,"design, install, or troubleshoot manufacturing equipment."
931,"design, integrate, or test photonics systems or components."
932,"design, make, or fit prosthodontic appliances, such as space maintainers, bridges, or dentures, or write fabrication instructions or prescriptions for denturists or dental technicians."
933,"design, organize, and deliver product awareness, skills transfer, or product education sessions for staff or suppliers."
934,"design, plan, organize, or direct orientation and training programs for employees or customers."
935,"design, program, or model geographic information systems (gis) applications or procedures."
936,"design, promote, or administer government plans or policies affecting land use, zoning, public utilities, community facilities, housing, or transportation."
937,"design, review and help administer insurance, annuity and pension plans, determining financial soundness and calculating premiums."
938,"design, use, or maintain databases and software applications, such as geographic information systems (gis) mapping and artificial intelligence tools."
939,"determine a published or broadcasted story's emphasis, length, and format and organize material accordingly."
940,"determine allocations of funds for staff, supplies, materials, and equipment and authorize purchases."
941,determine amounts and kinds of chemicals to use in destroying harmful organisms or removing impurities from purification systems.
942,"determine and specify details of survey projects, including sources of information, procedures to be used, and the design of survey instruments and materials."
943,determine applications of photonics appropriate to meet product objectives or features.
944,"determine appropriate sizes, ratings, and locations for all system overcurrent devices, disconnect devices, grounding equipment, and surge suppression equipment."
945,"determine campaign strategies for media advertising, positions on issues, and public appearances."
946,"determine commercial, industrial, scientific, or other uses for electro-optical applications or devices."
947,determine computer software or hardware needed to set up or alter system.
948,determine connection interfaces for additional subpanels or for connecting photovoltaic (pv) systems with utility services or other power generation sources.
949,determine data collection methods to be employed in research projects or surveys.
950,"determine desired images and picture composition, selecting and adjusting subjects, equipment, and lighting to achieve desired effects."
951,determine efficient and cost-effective methods of moving goods from one location to another.
952,"determine existence and amount of liability according to current laws, administrative and judicial precedents, and available evidence."
953,"determine fares based on trip distances and times, using taximeters and fee schedules, and announce fares to passengers."
954,"determine feasibility of designing new facilities or modifying existing facilities, based on factors such as cost, available space, schedule, technical requirements, or ergonomics."
955,determine food and beverage costs and assist in implementing cost control procedures.
956,"determine formats, approaches, content, levels, and mediums necessary to meet production objectives effectively and within budgetary constraints."
957,"determine formats, approaches, content, levels, and mediums to effectively meet objectives within budgetary constraints, using research, knowledge, and training."
958,"determine genetic composition of animal populations and heritability of traits, using principles of genetics."
959,determine guidelines that specify which source material is acceptable for use.
960,determine location for product listings to maximize exposure to online traffic.
961,"determine map content and layout, as well as production specifications such as scale, size, projection, and colors, and direct production to ensure that specifications are followed."
962,"determine materials, equipment, and installation sequences necessary to maximize installation efficiency."
963,"determine meal prices, based on calculations of ingredient prices."
964,"determine or help determine company policy, and explain complex technical matters to company executives, government officials, shareholders, policyholders, or the public."
965,determine packaging requirements.
966,"determine plant growing conditions, such as greenhouses, hydroponics, or natural settings, and set planting and care schedules."
967,determine policy contract provisions for each type of insurance.
968,determine price schedules and discount rates.
969,"determine regulations or procedures related to the management, collection, reuse, recovery, or recycling of packaging waste."
970,"determine replacement parts required, according to inspections of old parts, customer requests, or customers' descriptions of malfunctions."
971,"determine required equipment and welding methods, applying knowledge of metallurgy, geometry, and welding techniques."
972,"determine requirements for treatment, such as type, method and duration of therapy, precautions to be taken, or medication and dosages, compatible with physicians' orders."
973,"determine size and arrangement of illustrative material and copy, and select style and size of type."
974,"determine sources of web page or server problems, and take action to correct such problems."
975,"determine supplementary virtual features, such as currency, item catalog, menu design, and audio direction."
976,determine the value loss impact and criticality of assets.
977,"determine types and quantities of horticultural plants to be grown, based on budgets, projected sales volumes, or executive directives."
978,determine which products or colors will improve clients' skin quality and appearance.
979,"determine which topics to research, or pursue research topics specified by clients or employers."
980,develop advertising and other informational materials to be used in subject recruitment.
981,"develop advertising campaigns for a wide range of clients, working with an advertising agency's creative director and art director to determine the best way to present advertising information."
982,develop an understanding of customers' needs and take actions to ensure that such needs are met.
983,develop an understanding of fields to which statistical methods are to be applied to determine whether methods and results are appropriate.
984,"develop and direct software system testing and validation procedures, programming, and documentation."
985,"develop and distribute newsletters, brochures, or other printed materials to share information with patients or medical staff."
986,develop and document database architectures.
987,develop and document style guidelines for web site content.
988,"develop and implement data extraction procedures from other systems, such as administration, billing, or claims."
989,develop and implement individualized plans for health care management.
990,"develop and implement individualized treatment plans addressing family relationship problems, destructive patterns of behavior, and other personal issues."
991,"develop and implement marketing plans for home pages, including print advertising or advertisement rotation."
992,develop and implement organizational policies and procedures for the facility or medical unit.
993,develop and implement policies and procedures for the operation of a department or establishment.
994,"develop and implement purchasing and contract management instructions, policies, and procedures."
995,develop and implement solutions for network problems.
996,"develop and implement technical project management tools, such as plans, schedules, and responsibility and compliance matrices."
997,develop and implement treatment plans.
998,"develop and interpret organizational goals, policies, and procedures."
999,develop and maintain computer databases.
1000,"develop and maintain computerized record management systems to store and process data such as personnel activities and information, and to produce reports."
1001,"develop and maintain departmental policies, procedures, objectives, or patient care standards based on evidence-based practice guidelines or expert opinion."
1002,"develop and maintain design level documentation, including mechanics, guidelines, and mission outlines."
1003,"develop and maintain the company's corporate image and identity, which includes the use of logos and signage."
1004,develop and modify astronomy-related programs for public presentation.
1005,"develop and organize training manuals, multimedia visual aids, and other educational materials."
1006,"develop and participate in health promotion programs, group activities, or discussions to promote client health, facilitate social adjustment, alleviate stress, and prevent physical or mental disability."
1007,"develop and present health education and promotion programs, such as training workshops, conferences, and school or community presentations."
1008,"develop and test experimental designs, sampling techniques, and analytical methods."
1009,develop and test theories concerning the origin and development of past cultures.
1010,"develop and test theories, using information from interviews, newspapers, periodicals, case law, historical papers, polls, or statistical sources."
1011,"develop and write procedures for installation, use, or troubleshooting of communications hardware or software."
1012,develop application-specific software.
1013,develop applied software for the analysis and interpretation of geological data.
1014,"develop approaches to the solution of groups' problems, based on research findings in sociology and related disciplines."
1015,"develop biocatalytic processes to convert biomass to fuels or fine chemicals, using enzymes of bacteria, yeast, or other microorganisms."
1016,"develop briefings, brochures, multimedia presentations, web pages, promotional products, technical illustrations, and computer artwork for use in products, technical manuals, literature, newsletters, and slide shows."
1017,"develop budgets or approve expenditures for supplies, materials, or human resources, ensuring that materials, labor, or equipment are used efficiently to meet production targets."
1018,"develop business methods and procedures, including accounting systems, file systems, office systems, logistics systems, and production schedules."
1019,"develop calibration methodologies, test methodologies, or tools."
1020,"develop classroom-based and distance learning training courses, using needs assessments and skill level analyses."
1021,"develop client relationships and communicate with clients to explain proposals, present research findings, establish specifications, or discuss project status."
1022,"develop client treatment plans based on research, clinical experience, and client histories."
1023,"develop communications materials, advertisements, presentations, or public relations initiatives to promote awareness of green products and technologies."
1024,"develop comprehensive plans for immediate and long-term rehabilitation including therapeutic exercise; speech and occupational therapy; counseling; cognitive retraining; patient, family or caregiver education; or community reintegration."
1025,develop computational methods for solving problems that occur in areas of science and engineering or that come from applications in business or industry.
1026,"develop computer information resources, providing for data security and control, strategic computing, and disaster recovery."
1027,develop computer models to address transportation planning issues.
1028,develop concepts or creative ideas for craft objects.
1029,develop conceptual designs of security systems.
1030,"develop conceptual, logical, or physical network designs."
1031,"develop contacts with individuals and organizations, and apply effective strategies and techniques to ensure their clients' success."
1032,develop criteria for the design and modification of survey instruments.
1033,develop curricula and plan course content and methods of instruction.
1034,"develop curricula, and recommend curricula revisions and additions."
1035,"develop curriculum and prepare manuals, visual aids, course outlines, and other materials used in teaching."
1036,"develop data model describing data elements and how they are used, following procedures and using pen, template or computer software."
1037,develop data models and databases.
1038,"develop data models for applications, metadata tables, views or related database structures."
1039,"develop data warehouse process models, including sourcing, loading, transformation, and extraction."
1040,"develop database architectural strategies at the modeling, design and implementation stages to address business or industry requirements."
1041,develop databases that support web applications and web sites.
1042,"develop defense plans or tactics, using intelligence and other information."
1043,develop designs using specialized computer software.
1044,develop disaster recovery plans.
1045,"develop economic models, forecasts, or scenarios to predict future economic and environmental outcomes."
1046,"develop educational materials and programs for community agencies, local government, and state government."
1047,"develop environmental management or restoration plans for sites with power transmission lines, natural gas pipelines, fuel refineries, geothermal plants, wind farms, or solar farms."
1048,"develop exercise programs to improve participant strength, flexibility, endurance, or circulatory functioning, in accordance with exercise science standards, regulatory requirements, and credentialing requirements."
1049,"develop factors such as themes, plots, characterizations, psychological analyses, historical environments, action, and dialogue, to create material."
1050,"develop financial plans, based on analysis of clients' financial status."
1051,"develop formal documentation for microelectromechanical systems (mems) devices, including quality assurance guidance, quality control protocols, process control checklists, data collection, or reporting."
1052,"develop graphics and layouts for product illustrations, company logos, and web sites."
1053,"develop ideas for creating dances, keeping notes and sketches to record influences."
1054,develop ideas for programs and features that a station could produce.
1055,develop implementation plans that include analyses such as cost-benefit or return on investment (roi).
1056,develop in-service educational materials.
1057,develop individual treatment plans and strategies.
1058,"develop individualized treatment plans for patients, considering patient preferences, clinical data, or the risks and benefits of therapies."
1059,develop instruction or training roadmaps for online and blended learning programs.
1060,develop instructional materials and conduct in-service and community-based educational programs.
1061,develop instructional materials and products for technology-based redesign of courses.
1062,develop instructional materials for the public and make presentations to citizens' groups to provide information on emergency plans and their implementation processes.
1063,develop instructional materials to be used by educators and instructors.
1064,"develop instructional materials, such as lesson plans, handouts, or examinations."
1065,develop instrumentation and software for astronomical observation and analysis.
1066,"develop internal control policies, guidelines, and procedures for activities such as budget administration, cash and credit management, and accounting."
1067,"develop interview techniques, rating scales, and psychological tests used to assess skills, abilities, and interests for the purpose of employee selection, placement, and promotion."
1068,"develop job specifications, job descriptions, or work schedules."
1069,"develop manuals, texts, workbooks, or related materials for use in conjunction with production materials or for training."
1070,"develop manuals, texts, workbooks, or related materials for use in conjunction with production materials."
1071,"develop marketing materials, proposals, or presentation to generate new work opportunities."
1072,"develop marketing plans for finished products, collaborating with sales associates to supervise product distribution."
1073,develop marketing strategies to compete with other individuals or companies who sell insurance.
1074,"develop master course documentation or manuals according to applicable accreditation, certification, or other requirements."
1075,develop mathematical or statistical models of phenomena to be used for analysis or for computational simulation.
1076,develop measurement tools to evaluate the effectiveness of instruction or training interventions.
1077,develop methods for integrating different products so they work properly together such as customizing commercial databases to fit specific needs.
1078,"develop methods to improve employment policies, processes, and practices, and recommend changes to management."
1079,"develop methods to monitor employee satisfaction with policies or working conditions, including grievance or complaint procedures."
1080,develop models or computer simulations of human biobehavioral systems to obtain data for measuring or controlling life processes.
1081,develop network-related documentation.
1082,"develop new business by contacting potential clients, making sales presentations, and writing proposals."
1083,develop new chemical engineering processes or production techniques.
1084,"develop new or improved methods or products for controlling or eliminating weeds, crop diseases, or insect pests."
1085,"develop new or improved ways of preserving, processing, packaging, storing, and delivering foods, using knowledge of chemistry, microbiology, and other sciences."
1086,develop new principles and new relationships between existing mathematical principles to advance mathematical science.
1087,develop new recipes for baked goods.
1088,develop new software applications or customize existing applications to meet specific scientific project needs.
1089,develop new styles and techniques.
1090,develop or adopt new tests or instruments to improve diagnosis of diseases.
1091,develop or analyze information to assess the current or future financial status of firms.
1092,develop or apply data mining and machine learning algorithms.
1093,"develop or approve project plans, schedules, or budgets."
1094,develop or assist in the development of transportation-related computer software or computer processes.
1095,"develop or configure document management system features, such as user interfaces, access profiles, and document workflow procedures."
1096,develop or coordinate fitness and wellness programs or services.
1097,develop or deliver proposals or presentations on topics such as the purchase or sale of energy.
1098,"develop or deliver training programs for health information technology, creating operating manuals as needed."
1099,develop or direct development of offering documents or marketing materials.
1100,develop or direct software system testing or validation procedures.
1101,develop or direct study courses or religious education programs within congregations.
1102,"develop or document reverse logistics management processes to ensure maximal efficiency of product recycling, reuse, or final disposal."
1103,develop or document style guidelines for web site content.
1104,develop or implement data analysis algorithms.
1105,develop or implement electronic maintenance programs or computer information management systems.
1106,develop or implement fund investment policies or strategies.
1107,develop or implement marketing strategies.
1108,develop or implement plans and procedures for ophthalmologic services.
1109,"develop or implement policies or practices to ensure the privacy, confidentiality, or security of patient information."
1110,develop or implement policy evaluation procedures for hydroelectric generation activities.
1111,develop or implement procedures for ongoing web site revision.
1112,develop or implement procedures or systems to evaluate or select suppliers.
1113,"develop or implement product-marketing strategies, including advertising campaigns or sales promotions."
1114,develop or implement programs to improve sustainability or reduce the environmental impacts of engineering or architecture activities or operations.
1115,"develop or implement projects to improve efficiency, economy, or effectiveness of hydroelectric plant operations."
1116,develop or implement quality control programs.
1117,develop or implement risk-assessment models or methodologies.
1118,"develop or implement treatment plans for problems such as stuttering, delayed language, swallowing disorders, or inappropriate pitch or harsh voice problems, based on own assessments and recommendations of physicians, psychologists, or social workers."
1119,"develop or maintain applications that process biologically based data into searchable databases for purposes of analysis, calculation, or presentation."
1120,"develop or maintain archived procedures, procedural codes, or queries for applications."
1121,"develop or maintain cost estimates, forecasts, or cost models."
1122,develop or maintain internal or external company web sites.
1123,"develop or maintain models for logistics uses, such as cost estimating or demand forecasting."
1124,develop or maintain online help documentation.
1125,develop or maintain payment systems to ensure accuracy of vendor payments.
1126,develop or maintain programs associated with automated production equipment.
1127,develop or maintain project reporting systems.
1128,"develop or maintain standards, such as organization, structure, or nomenclature, for the design of data warehouse elements, such as data architectures, models, tools, and databases."
1129,"develop or manage integrated security controls to ensure confidentiality, accountability, recoverability, or audit ability of sensitive information, proprietary information, or information technology resources."
1130,"develop or modify industrial electronic devices, circuits, or equipment, according to available specifications."
1131,develop or monitor procedures to ensure adequate quality control of images.
1132,"develop or recommend network security measures, such as firewalls, network security audits, or automated security probes."
1133,develop or review specifications for design or construction of security systems.
1134,"develop or revise business plans for online business, emphasizing factors such as product line, pricing, inventory, or marketing strategy."
1135,develop or select specific software programs for various research scenarios.
1136,develop or test new methods or models of transportation analysis.
