,task_name
2264,"prepare daily food items, and cook simple foods and beverages, such as sandwiches, salads, soups, pizza, or coffee, using proper safety precautions and sanitary measures."
2265,"prepare data analysis listings and activity, performance, or progress reports."
2266,"prepare data for processing by organizing information, checking for any inaccuracies, and adjusting and weighting the raw data."
2267,"prepare data summaries, reports, or analyses that include results, charts, or graphs to document research findings and results."
2268,prepare design presentations and proposals for staff or customers.
2269,"prepare detailed job descriptions and classification systems and define job levels and families, in partnership with other managers."
2270,"prepare detailed network specifications, including diagrams, charts, equipment configurations, or recommended technologies."
2271,prepare detailed reports on audit findings.
2272,prepare detailed storyboards showing sequence and timing of story development for television production.
2273,"prepare detailed verbal or written presentations for scientists, engineers, project managers, or upper management."
2274,"prepare detailed workflow charts and diagrams that describe input, output, and logical operation, and convert them into a series of instructions coded in a computer language."
2275,prepare diagnostic and treatment records.
2276,prepare diagnostic or treatment reports for other medical practitioners or therapists.
2277,"prepare documentation containing information such as confidential descriptions or specifications of proprietary hardware or software, product development or introduction schedules, product costs, or information about product performance weaknesses."
2278,prepare documentation for case reports or court proceedings.
2279,"prepare documentation or presentations, including charts, photos, or graphs."
2280,prepare documents needed to implement plans selected by clients.
2281,prepare documents recording the outcomes of court proceedings.
2282,"prepare documents to be used in legal proceedings, testifying in such proceedings when necessary."
2283,"prepare documents, such as invoices or warranties."
2284,"prepare documents, such as work orders, bills of lading, or shipping orders, to route materials."
2285,"prepare dough, following recipe."
2286,"prepare drafts of amendments, government policies, laws, rules, regulations, budgets, programs and procedures."
2287,"prepare drawings, estimates, and bids that meet specific customer needs."
2288,"prepare environmental impact statements, reports, or presentations for regulatory or other agencies."
2289,"prepare evaluations of software or hardware, and recommend improvements or upgrades."
2290,"prepare financial or regulatory reports required by laws, regulations, or boards of directors."
2291,prepare financial reports to monitor client or corporate finances.
2292,"prepare financial reports, such as reviews of portfolio positions."
2293,prepare forms and manuals for accounting and bookkeeping personnel and direct their work activities.
2294,prepare forms or agreements to complete sales.
2295,prepare functional or technical documentation for data warehouses.
2296,"prepare government or organizational reports on birth, death, and disease statistics, workforce evaluations, or the medical status of individuals."
2297,"prepare government or organizational reports which include birth, death, and disease statistics, workforce evaluations, or medical status of individuals."
2298,"prepare grant proposals, budgets, and program policies and goals or assist in their preparation."
2299,prepare graphic representations or drawings of proposed plans or designs.
2300,"prepare graphs, charts, diagrams, or other aids to illustrate observations or conclusions."
2301,"prepare information regarding design, structure specifications, materials, color, equipment, estimated costs, or construction time."
2302,"prepare instructional program objectives, outlines, and lesson plans."
2303,prepare insurance claim forms or related documents and review them for completeness.
2304,prepare insurance forms to indicate repair cost estimates and recommendations.
2305,prepare invoices or cost quotations for freight transportation.
2306,"prepare invoices, reports, memos, letters, financial statements, and other documents, using word processing, spreadsheet, database, or presentation software."
2307,"prepare invoices, shipping documents, and contracts."
2308,"prepare itemized statements, bills, or invoices and record amounts due for items purchased or services rendered."
2309,"prepare layouts, drawings, or sketches of machinery or equipment, such as shop tooling, scale layouts, or new equipment design, using drafting equipment or computer-aided design (cad) software."
2310,"prepare legal briefs and opinions, and file appeals in state and federal courts of appeal."
2311,"prepare legal documents, including briefs, pleadings, appeals, wills, contracts, and real estate closing statements."
2312,prepare management reports defining and evaluating problems and recommending solutions.
2313,"prepare manuals and train workers in use of new forms, reports, procedures or equipment, according to organizational policy."
2314,prepare materials and classrooms for class activities.
2315,"prepare materials for charitable events, such as fundraising envelopes, bid sheets, or gift bags."
2316,"prepare materials for laboratory activities and course materials such as syllabi, homework assignments, and handouts."
2317,"prepare measurement tables and conversion charts, using standard formulas."
2318,prepare meeting agendas or packets of related information.
2319,"prepare meeting agendas, attend meetings, and record and transcribe minutes."
2320,"prepare necessary criteria, procedures, reports, or plans for successful conduct of the project with consideration given to site preparation, facility validation, installation, quality assurance, or testing."
2321,prepare notes and instructions for workers who assemble and prepare final layouts for printing.
2322,"prepare notes, sketches, geological maps, or cross sections."
2323,"prepare objectives and outlines for courses of study, following curriculum guidelines or requirements of states and schools."
2324,"prepare objectives, outlines, or other materials for courses of study following curriculum guidelines or school or state requirements."
2325,"prepare objectives, outlines, or other materials for courses of study, following curriculum guidelines or requirements."
2326,"prepare occupational classifications, job descriptions and salary scales."
2327,"prepare operating and maintenance manuals, studies, or reports."
2328,prepare operational or risk reports for management analysis.
2329,prepare or alter presentation contents to target specific audiences.
2330,prepare or assist in preparing simple to complex tax returns for individuals or small businesses.
2331,prepare or calibrate equipment used to collect or analyze samples.
2332,prepare or deliver reports or presentations of geospatial project information.
2333,prepare or deliver speeches to further public relations objectives.
2334,"prepare or direct preparation of correspondence, reports, and operations, maintenance, and safety manuals."
2335,"prepare or direct preparation of financial statements, business activity reports, financial position forecasts, annual budgets, or reports required by regulatory agencies."
2336,"prepare or edit organizational publications, such as employee newsletters or stockholders' reports, for internal or external audiences."
2337,"prepare or interpret for clients information such as investment performance reports, financial document summaries, or income projections."
2338,"prepare or maintain design, testing, or operational records and documentation."
2339,"prepare or maintain employment records related to events such as hiring, termination, leaves, transfers, or promotions, using human resources management system software."
2340,"prepare or monitor project schedules, budgets, or cost control systems."
2341,"prepare or organize online storefront marketing material, including product descriptions or subject lines, optimizing content to search engine criteria."
2342,prepare or present agricultural demonstrations.
2343,"prepare or present reports concerning activities, expenses, budgets, government statutes or rulings, or other items affecting businesses or program services."
2344,prepare or present technical or project status reports.
2345,prepare or proctor examinations.
2346,prepare or provide genetics-related educational materials to patients or medical personnel.
2347,prepare or review engineering studies or specifications.
2348,"prepare or serve hot or cold beverages, such as coffee, espresso drinks, blended coffees, or teas."
2349,"prepare or serve menu items, such as sandwiches or salads."
2350,"prepare or supervise preparation of all data, charts, plots, maps, records, and documents related to surveys."
2351,"prepare or use prepared tissue specimens for teaching, research or diagnostic purposes."
2352,prepare outlines of instructional programs and training schedules and establish course goals.
2353,prepare people for participation in religious ceremonies.
2354,prepare periodic accounting statements for clients.
2355,prepare personnel forecast to project employment needs.
2356,"prepare plans of action for investment, using financial analyses."
2357,"prepare plans that outline operating procedures to be used in response to disasters or emergencies, such as hurricanes, nuclear accidents, and terrorist attacks, and in recovery from these events."
2358,"prepare plans, estimates, design and construction schedules, and contract specifications, including any special provisions."
2359,"prepare preventive health reports including problem descriptions, analyses, alternative solutions, and recommendations."
2360,"prepare project budgets, schedules, or specifications for labor or materials."
2361,prepare project proposals.
2362,prepare project reports and other program or technical documentation.
2363,"prepare project status reports by collecting, analyzing, and summarizing information and trends."
2364,"prepare promotional plans, sales literature, media kits, and sales contracts, using computer."
2365,"prepare proposals, quotes, contracts, or presentations for potential solar customers."
2366,"prepare publications and exhibits, or review those prepared by others, to ensure their historical accuracy."
2367,prepare publications and reports containing research findings.
2368,prepare purchase orders and send copies to suppliers and to departments originating requests.
2369,"prepare purchase orders, solicit bid proposals, and review requisitions for goods and services."
2370,"prepare real estate closing statements, using knowledge and expertise in real estate procedures."
2371,prepare reports and document project activities and data.
2372,"prepare reports describing any title encumbrances encountered during searching activities, and outlining actions needed to clear titles."
2373,prepare reports documenting investigation activities and results.
2374,"prepare reports of activities, evaluations, recommendations, or decisions."
2375,"prepare reports of findings and recommendations, using typewriters or computers."
2376,"prepare reports of findings, illustrating data graphically and translating complex findings into written text."
2377,"prepare reports on activity, personnel, and information such as occupancy, hours worked, facility usage, work performed, and departmental expenses."
2378,prepare reports on civic needs.
2379,prepare reports on logistics performance measures.
2380,prepare reports on non-destructive testing (ndt) results.
2381,prepare reports on students and activities as required by administration.
2382,"prepare reports on the operation of conservation laboratories, documenting the condition of artifacts, treatment options, and the methods of preservation and repair used."
2383,"prepare reports or correspondence concerning project specifications, activities, or status."
2384,"prepare reports or make presentations on internal investigations, losses, or violations of regulations, policies and procedures."
2385,prepare reports or presentations to communicate employee satisfaction or related data to management.
2386,prepare reports or recommendations on transportation planning.
2387,"prepare reports or recommendations, based upon research outcomes."
2388,"prepare reports outlining past and future programs, including content."
2389,"prepare reports regarding any problems encountered, such as accidents, signaling problems, unscheduled stops, or delays."
2390,prepare reports regarding inventories of raw materials or finished products.
2391,prepare reports regarding market conditions and merchandise costs.
2392,prepare reports required by state and federal laws.
2393,prepare reports summarizing information or trends related to manufacturing performance.
2394,"prepare reports summarizing operational results, financial performance, or accomplishments of specified objectives, goals, or plans."
2395,prepare reports that detail investigation findings.
2396,prepare reports to be submitted to company's data processing department.
2397,"prepare reports to communicate information such as contamination test results, decontamination results, or decontamination procedures."
2398,prepare reports to document patients' care activities.
2399,prepare reports to provide answers in response to specific problems.
2400,"prepare reports, deliver presentations, or participate in program review activities to communicate engineering results or recommendations."
2401,"prepare reports, exhibits and other supporting schedules that detail an institution's safety and soundness, compliance with laws and regulations, and recommended solutions to questionable financial conditions."
2402,"prepare reports, including assignment of company funds or recording of department revenues."
2403,"prepare reports, manuscripts, and meeting presentations."
2404,"prepare reports, manuscripts, proposals, and technical manuals for use by other scientists and requestors, such as sponsors and customers."
2405,"prepare reports, sketches, working drawings, specifications, proposals, and budgets for proposed sites or systems."
2406,"prepare reports, such as organization and flow charts, and career path reports, to summarize job analysis and evaluation and compensation analysis information."
2407,"prepare reports, using statistics, charts, and graphs, to illustrate planning studies in areas such as population, land use, or zoning."
2408,prepare requests for proposals or statements of work.
2409,prepare requirements documentation for use by software developers.
2410,"prepare research results for publication in form of journals, books, manuals, and film."
2411,prepare responses to correspondence containing routine inquiries.
2412,"prepare responses to customer requests for information, such as product data, written regulatory affairs statements, surveys, or questionnaires."
2413,prepare results of experimental findings for presentation at professional conferences or in scientific journals.
2414,prepare sales contracts and order forms.
2415,prepare sales presentations or proposals to explain product specifications or applications.
2416,"prepare sample layouts for approval, using computer software."
2417,"prepare scale drawings or architectural designs, using computer-aided design or other tools."
2418,"prepare scientific atmospheric or climate reports, articles, or texts."
2419,prepare settlement agreements for disputants to sign.
2420,"prepare shipping documentation, such as including bills of lading, packing lists, dock receipts, or certificates of origin."
2421,"prepare site plans, specifications, or cost estimates for land development."
2422,"prepare solar installation project proposals, quotes, budgets, or schedules."
2423,"prepare specialty foods such as pizzas, fish and chips, sandwiches, and tacos, following specific methods that usually require short preparation time."
2424,"prepare specifications, designs, or sketches for machines, components, or systems related to the generation, transmission, or use of mechanical or fluid energy."
2425,"prepare standard volumetric solutions or reagents to be combined with samples, following standardized formulas or experimental procedures."
2426,"prepare statistical reports, narrative reports, or graphic presentations of information, such as tumor registry data for use by hospital staff, researchers, or other users."
2427,"prepare students for performances, exams, or assessments."
2428,"prepare study reports, memoranda, briefs, testimonies, or other written materials to inform government or environmental groups on environmental issues such as climate change."
2429,"prepare study-related documentation such as protocol worksheets, procedural manuals, adverse event reports, institutional review board documents, and progress reports."
2430,prepare summary statistics of information regarding human genomes.
2431,prepare support documentation and training materials for end users of document management systems.
2432,prepare system activity and performance reports.
2433,prepare tables and graphs to present clinical data or results.
2434,"prepare tables, graphs, fact sheets, and written reports summarizing research results."
2435,"prepare technical drawings, specifications of electrical systems, or topographical maps to ensure that installation and operations conform to standards and customer requirements."
2436,prepare technical reports and recommendations based upon research outcomes.
2437,"prepare technical reports for use by engineering, management, or sales personnel."
2438,"prepare technical reports, data summary documents, or research articles for scientific publication, regulatory submissions, or patent applications."
2439,"prepare test solutions, compounds, or reagents for laboratory personnel to conduct tests."
2440,"prepare weather reports or maps for analysis, distribution, or use in weather broadcasts, using computer graphics."
2441,"prepare work for sale or exhibition, and maintain relationships with retail, pottery, art, and resource networks that can facilitate sale or exhibition of work."
2442,"prepare work orders for repair, maintenance, or changes in traffic systems."
2443,"prepare written and oral reports describing research results, using illustrations, maps, appendices, and other information."
2444,prepare written documents to establish contracts with or communicate financial recommendations to clients.
2445,prepare written opinions and decisions.
2446,prepare written opinions or decisions regarding cases.
2447,prepare written reports of investigation findings.
2448,prepare written reports on investigations.
2449,"prepare written reports that estimate property values, outline methods by which the estimations were made, and meet appraisal standards."
2450,"prepare, administer, and grade tests and assignments to evaluate students' progress."
2451,"prepare, administer, or grade tests or assignments to evaluate students' progress."
2452,"prepare, analyze, and verify annual reports, financial statements, and other records, using accepted accounting and statistical procedures to assess financial condition and facilitate financial planning."
2453,"prepare, examine, or analyze accounting records, financial statements, or other financial reports to assess accuracy, completeness, and conformance to reporting and procedural standards."
2454,"prepare, maintain, and record records of inventories, receipts, purchases, or deliveries, using a variety of computer screen formats."
2455,"prepare, maintain, and review purchasing files, reports and price lists."
2456,"prepare, maintain, or update security procedures, security system drawings, or related documentation."
2457,"prepare, manipulate, and manage extensive databases."
2458,"prepare, or direct the preparation of, product or system layouts and detailed drawings and schematics."
2459,"prepare, review, or maintain maintenance schedules, design documentation, or operational reports or charts."
2460,"prepare, review, or update environmental investigation or recommendation reports."
2461,"prepare, rewrite and edit copy to improve readability, or supervise others who do this work."
2462,"prepare, store, and retrieve classification and catalog information, lecture notes, or other information related to stored documents, using computers."
2463,"prescribe individualized exercise programs, specifying equipment such as treadmill, exercise bicycle, ergometers, or perceptual goggles."
2464,"prescribe medications based on efficacy, safety, and cost as legally authorized."
2465,"prescribe or administer treatment, therapy, medication, vaccination, and other specialized medical care to treat or prevent illness, disease, or injury in infants and children."
2466,"present and explain proposals, reports, or findings to clients."
2467,"present and make recommendations regarding course design, technology, and instruction delivery options."
2468,present clear and concise explanations of governing rules and regulations.
2469,present clients with information required to make informed health care and treatment decisions.
2470,present drafts and ideas to clients.
2471,"present historical accounts in terms of individuals or social, ethnic, political, economic, or geographic groupings."
2472,"present information in audio-visual or interactive formats, using computers, television, audio-visual aids, or other equipment, materials, or technologies."
2473,"present information in audio-visual or interactive formats, using computers, televisions, audio-visual aids, or other equipment, materials, or technologies."
2474,"present information using a variety of instructional techniques or formats, such as role playing, simulations, team exercises, group discussions, videos, or lectures."
2475,"present investment information, such as product risks, fees, or fund performance statistics."
2476,"present lectures and conduct discussions to increase students' knowledge and competence using visual aids, such as graphs, charts, videotapes, and slides."
2477,"present oral or written reports on general economic trends, individual corporations, and entire industries."
2478,"present project plans or designs to public stakeholders, such as government agencies or community groups."
2479,present research findings at scientific conferences and in papers written for scientific journals.
2480,present research findings to groups of people.
2481,"present statistical and nonstatistical results using charts, bullets, and graphs in meetings or conferences to audiences such as clients, peers, and students."
2482,"present water resource proposals to government, public interest groups, or community groups."
2483,"preserve records, documents, and objects, copying records to film, videotape, audiotape, disk, or computer formats as necessary."
2484,"process and prepare documents, such as business or government forms and expense reports."
2485,"process and prepare memos, correspondence, travel vouchers, or other documents."
2486,process and record new insurance policies and claims.
2487,process and review employment applications to evaluate qualifications or eligibility of applicants.
2488,"process claims against the municipality, maintaining files and log of claims, and coordinate claim response and handling with municipal claims administrators."
2489,"process clinical data, including receipt, entry, verification, or filing of information."
2490,"process data for analysis, using computers."
2491,"process large amounts of data for statistical modeling and graphic analysis, using computers."
2492,"process, prepare, and submit business or government forms, such as submitting applications for coverage to insurance carriers."
2493,"process, verify, and maintain personnel related documentation, including staffing, recruitment, training, grievances, performance evaluations, classifications, and employee leaves of absence."
2494,"procure, produce, and provide information on the safe operation of aircraft, such as flight planning publications, operations publications, charts and maps, and weather information."
2495,produce a computer-generated or film image for interpretation by a physician.
2496,"produce detailed images or measurement of objects, using tools such as scanning tunneling microscopes or oscilloscopes."
2497,"produce medical reports, correspondence, records, patient-care information, statistics, medical research, and administrative material."
2498,produce or evaluate dental health educational materials.
2499,"produce reports or presentations that outline findings, explain risk positions, or recommend changes."
2500,produce rough and finished graphics and graphic designs.
2501,"produce up-to-the-minute information, using internal computer systems, to allow management to base decisions on actual, not historical, data."
2502,produce written summary reports of financial research results.
2503,"program and use computers to store, process, and analyze data."
2504,program computerized graphic effects.
2505,"program computers or electronic instruments, such as numerically controlled machine tools."
2506,program electronic equipment.
2507,promote awareness or use of alternative or renewable energy sources.
2508,promote initiatives to mitigate climate change with government or environmental groups.
2509,"promote products in online communities through weblog or discussion-forum postings, e-mail marketing programs, or online advertising."
2510,"promote sales of properties through advertisements, open houses, and participation in multiple listing services."
