,task_name
0,accept commissions to create music for special occasions.
1,act as advisers to student organizations.
2,act as an advocate for farmers or farmers' groups.
3,act as an intermediary in negotiations between buyers and sellers over property prices and settlement details and during the closing of sales.
4,"act as an intermediary in negotiations between buyers and sellers, generally representing one or the other."
5,act as liaisons between on-site managers or tenants and owners.
6,adapt instructional content or delivery methods for different levels or types of learners.
7,adapt or design computer hardware or software for medical science uses.
8,adapt software and accompanying technical documents to another language and culture.
9,adapt teaching methods and instructional materials to meet students' varying needs and interests.
10,adapt text to accommodate musical requirements of composers and singers.
11,adapt the quantity of ingredients to match the amount of items to be baked.
12,"adapt translations to students' cognitive and grade levels, collaborating with educational team members as necessary."
13,"address employee relations issues, such as harassment allegations, work complaints, or other employee concerns."
14,"address legal issues, such as child abuse and discipline, assisting with hearings and providing testimony to inform custody arrangements."
15,"address the relationships of quantities, magnitudes, and forms through the use of numbers and symbols."
16,"adjust controls to regulate temperature, pressure, feed, or flow of liquids or gases and times of prescribed reactions, according to knowledge of equipment and processes."
17,"adjust digital files to alter print elements, such as fonts, graphics, or color separations."
18,adjust sales scripts to better target the needs and interests of specific individuals.
19,"adjust, maintain, or repair laboratory equipment such as microscopes."
20,"adjust, repair, or replace malfunctioning components or assemblies, using hand tools or soldering irons."
21,administer document and system access rights and revision control to ensure security of system and integrity of master documents.
22,"administer highway planning, construction, or maintenance."
23,administer online purchasing systems.
24,administer standardized ability and achievement tests and interpret results to determine students' strengths and areas of need.
25,"administer treatments or therapies, such as homeopathy, hydrotherapy, oriental or ayurvedic medicine, electrotherapy and diathermy, using physical agents including air, heat, cold, water, sound, or ultraviolet light to catalyze the body to heal itself."
26,"administer, dispense, or prescribe natural medicines such as food or botanical extracts, herbs, dietary supplements, vitamins, nutraceuticals, and amino acids."
27,"administer, proctor, or score academic or diagnostic assessments."
28,"advise animal owners regarding sanitary measures, feeding, general care, medical conditions, or treatment options."
29,"advise attorneys, juries, litigants, and court personnel regarding conduct, issues, and proceedings."
30,"advise business or other groups on local, national, or international factors affecting the buying or selling of products or services."
31,"advise client on interior design factors such as space planning, layout and use of furnishings or equipment, and color coordination."
32,advise clients about proper clothing and shoes.
33,"advise clients concerning business transactions, claim liability, advisability of prosecuting or defending lawsuits, or legal rights and obligations."
34,advise clients on financial and legal matters such as investments and taxes.
35,advise clients on how they could be helped by counseling.
36,"advise clients on market conditions, prices, mortgages, legal requirements and related matters."
37,advise clients on nail care and use of products and colors.
38,"advise clients or community groups on issues related to improving general health, such as diet or exercise."
39,"advise construction firms or government agencies on dam or road construction, foundation design, land use, or resource management."
40,advise corporations on issues involving corporate image projects or problems.
41,advise customer about or perform maintenance of software system.
42,"advise customers concerning equipment operation, maintenance, or programming."
43,advise customers of necessary actions and strategies for debt repayment.
44,advise customers on plant selection or care.
45,advise customers on product usage to improve production.
46,advise customers on use and care of merchandise.
47,advise farm groups or growers on land preparation or livestock care techniques that will maximize the quantity and quality of production.
48,"advise farmers and demonstrate techniques in areas such as feeding and health maintenance of livestock, growing and harvesting practices, and financial planning."
49,advise farmers or growers of development programs or new equipment or techniques to aid in quality production.
50,"advise food service managers and organizations on sanitation, safety procedures, menu development, budgeting, and planning to assist with the establishment, operation, and evaluation of food service facilities and nutrition programs."
51,advise internal management or business partners on the implementation or operation of compliance programs.
52,"advise licensees or other individuals or groups concerning licensing, permit, or passport regulations."
53,"advise management concerning personnel, managerial, and marketing policies and practices and their potential effects on organizational effectiveness and efficiency."
54,advise management on matters related to the administration of contracts or employee discipline or grievance procedures.
55,"advise management on organizing, preparing, or implementing recruiting or retention programs."
56,"advise management on short-term and long-term financial objectives, policies, and actions."
57,"advise management on such matters as equal employment opportunity, sexual harassment and discrimination."
58,"advise management regarding customer satisfaction, product performance, or suggestions for product improvements."
59,"advise managers and employees on state and federal employment regulations, collective agreements, benefit and compensation policies, personnel procedures and classification programs."
60,"advise managers on organizational policy matters such as equal employment opportunity and sexual harassment, and recommend needed changes."
61,advise or assist in obtaining patents or meeting other legal requirements.
62,advise or consult with individuals and institutions regarding issues such as the historical authenticity of materials or the customs of a specific historical period.
63,"advise or instruct patients regarding preventive dental care, the causes and treatment of dental problems, or oral health care services."
64,advise participants in use of heat or ultraviolet treatments and hot baths.
65,advise patients about recommended courses of treatment.
66,advise patients about therapeutic exercise and nutritional medicine regimens.
67,"advise patients and community members concerning diet, activity, hygiene, and disease prevention."
68,"advise patients and their families on nutritional principles, dietary plans and diet modifications, and food selection and preparation."
69,"advise patients, parents or guardians, and community members concerning diet, activity, hygiene, and disease prevention."
70,"advise personnel about traffic problems, such as construction areas, accidents, congestion, weather conditions, or other hazards."
71,"advise planning officials on project feasibility, cost-effectiveness, regulatory conformance, or possible alternatives."
72,advise producers about improved products and techniques that could enhance their animal production efforts.
73,"advise project teams on subjects such as premarket regulatory requirements, export and labeling requirements, or clinical study compliance issues."
74,advise students on academic and vocational curricula and on career issues.
75,"advise students on academic and vocational curricula, and on career issues."
76,"advise students on academic and vocational curricula, career issues, and laboratory and field research."
77,"advise students on internships, prospective employers, and job placement services."
78,"advise students on issues such as course selection, progress toward graduation, and career decisions."
79,advocate for accessible health care that minimizes environmental health risks.
80,"advocate for patients' and families' needs, or provide emotional support for patients and their families."
81,"advocate for sustainability to community groups, government agencies, the general public, or special interest groups."
82,"align, adjust, or calibrate equipment according to specifications."
83,"allocate print space for story text, photos, and illustrations according to space parameters and copy significance, using knowledge of layout principles."
84,"analyze a script, noting events that affect each character's appearance, so that plans can be made for each scene."
85,analyze all aspects of corporate logistics to determine the most cost-effective or efficient means of transporting products or supplies.
86,"analyze and characterize user experiences and institutional settings to assist consumer product developers, technology developers, and software engineers with the design of innovative products and services."
87,analyze and classify risks and investments to determine their potential impacts on companies.
88,"analyze and distill climate-related research findings to inform legislators, regulatory agencies, or other stakeholders."
89,analyze and evaluate patient data or test findings to diagnose nature or extent of mental disorder.
90,analyze and evaluate robotic systems or prototypes.
91,"analyze and evaluate security operations to identify risks or opportunities for improvement through auditing, review, or assessment."
92,"analyze and implement engineering designs for producing electronic devices and systems and microprocessor-based control applications, applying principles of mathematics, digital signal processing, network analysis, and computer engineering."
93,analyze and interpret data to increase the understanding of human social behavior.
94,analyze and interpret news and information received from various sources to broadcast the information.
95,"analyze and interpret patient, nursing, or information systems data to improve nursing services."
96,"analyze and interpret patients' histories, symptoms, physical findings, or diagnostic information to develop appropriate diagnoses."
97,"analyze and interpret results from tests such as microbial or parasite tests, urine analyses, hormonal assays, fine needle aspirations (fnas), and polymerase chain reactions (pcrs)."
98,analyze and modify compensation and benefits policies to establish competitive programs and ensure compliance with legal requirements.
99,"analyze and recommend chemical, biological, or other wastewater treatment methods to prepare water for industrial or domestic use."
100,analyze and record personnel or operational data and write related activity reports.
101,"analyze and record test data to issue reports that use charts, graphs, or narratives."
102,analyze and report computer network security breaches or attempted breaches.
103,analyze available data and consult with other scientists to determine parameters of experimentation and suitability of analytical models.
104,"analyze blueprints and other documentation to prepare time, cost, materials, and labor estimates."
105,"analyze building codes, by-laws, space and site requirements, and other technical documents and reports to determine their effect on architectural designs."
106,"analyze business operations, trends, costs, revenues, financial commitments, and obligations to project future revenues and expenses or to provide advice."
107,analyze changes designed to improve the environmental performance of complex systems to avoid unintended negative consequences.
108,analyze characteristics of animals to identify and classify them.
109,"analyze chromosomes found in biological specimens to aid diagnoses and treatments for genetic diseases such as congenital birth defects, fertility problems, and hematological disorders."
110,analyze clinical data using appropriate statistical tools.
111,"analyze clinical or survey data using statistical approaches such as longitudinal analysis, mixed effect modeling, logistic regression analyses, and model building techniques."
112,"analyze compensation policies, government regulations, and prevailing wage rates to develop competitive compensation plan."
113,"analyze competitive market strategies through analysis of related product, market, or share trends."
114,analyze completed police reports to determine what additional information and investigative work is needed.
115,"analyze complex systems to determine potential for further development, production, interoperability, compatibility, or usefulness in a particular area, such as aviation."
116,"analyze computer and information technologies to determine applicability to nursing practice, education, administration and research."
117,"analyze corporate intelligence data to identify trends, patterns, or warnings indicating threats to security of people, assets, information, or infrastructure."
118,analyze credit data and financial statements to determine the degree of risk involved in extending credit or lending money.
119,"analyze data from surveys, old records, or case studies, using statistical software."
120,"analyze data such as interview notes, test results, and reference manuals to identify symptoms and to diagnose the nature of clients' problems."
121,analyze data to assess distance learning program status or to inform decisions for distance learning programs.
122,analyze data to determine answers to questions from customers or members of the public.
123,analyze data to determine feasibility of product proposals.
124,analyze data to determine the effectiveness of specific treatments or therapy approaches.
125,analyze data to determine the effectiveness of treatments or therapy approaches.
126,"analyze data to determine validity, quality, and scientific significance and to interpret correlations between human activities and environmental effects."
127,"analyze data, using statistical methods and applications, to evaluate the outcomes and effectiveness of workplace programs."
128,analyze details of sales territories to assess their growth potential and to set quotas.
129,"analyze determinants responsible for specific inherited traits, and devise methods for altering traits or producing new traits."
130,analyze developments in specific field to determine need for revisions in previously published materials and development of new material.
131,"analyze electronics system requirements, capacity, cost, or customer needs to determine project feasibility."
132,analyze employment-related data and prepare required reports.
133,analyze energy bills including utility rates or tariffs to gather historical energy usage data.
134,analyze equipment performance records to assess equipment functioning.
135,analyze equipment performance records to determine the need for repair or replacement.
136,analyze existing development or manufacturing procedures and suggest improvements.
137,"analyze expenditures and other financial information to develop plans, policies, or budgets for increasing profits or improving services."
138,analyze experimental data and interpret results to write reports and summaries of findings.
139,"analyze factors such as weather reports, fuel requirements, or maps to determine air routes."
140,analyze financial activities of establishments or departments and provide input into budget planning and preparation processes.
141,"analyze financial data such as income growth, quality of management, and market share to determine expected profitability of loans."
142,"analyze financial data to detect irregularities in areas such as billing trends, financial relationships, and regulatory compliance procedures."
143,analyze financial information obtained from clients to determine strategies for meeting clients' financial objectives.
144,analyze financial or operational performance of companies facing financial difficulties to identify or recommend remedies.
145,analyze genetic information to identify patients or families at risk for specific disorders or syndromes.
146,"analyze geographic distributions of physical and cultural phenomena on local, regional, continental, or global scales."
147,"analyze geographic information systems (gis) data to identify spatial relationships or display results of analyses, using maps, graphs, or tabular data."
148,analyze green product marketing or sales trends to forecast future conditions.
149,"analyze historical climate information, such as precipitation or temperature records, to help predict future weather or climate trends."
150,analyze information from traffic counting programs.
151,analyze information gathered by investigation and report findings and recommendations.
152,analyze information obtained from management to conceptualize and define operational problems.
153,"analyze information processing or computation needs and plan and design computer systems, using techniques such as structured analysis, data modeling and information engineering."
154,"analyze information to determine, recommend, and plan computer specifications and layouts, and peripheral equipment modifications."
155,"analyze information to determine, recommend, and plan installation of a new system or modification of an existing system."
156,"analyze information to determine, recommend, and plan layout, including type of computers and peripheral equipment modifications."
157,"analyze job requirements and content to establish criteria for classification, selection, training, and other related personnel functions."
158,analyze laboratory findings to check the accuracy of the results.
159,"analyze large molecular datasets such as raw microarray data, genomic sequence data, and proteomics data for clinical or basic research purposes."
160,"analyze logistics data, using methods such as data mining, data modeling, or cost or benefit analysis."
161,analyze market conditions to determine optimum times to execute securities transactions.
162,"analyze menus or recipes, standardize recipes, or test new products."
163,analyze monthly department budgeting and accounting reports to maintain expenditure controls.
164,"analyze network data to determine network usage, disk space availability, or server function."
165,analyze new medical procedures to forecast likely outcomes.
166,"analyze operations to evaluate performance of a company or its staff in meeting objectives or to determine areas of potential cost reduction, program improvement, or policy change."
167,analyze or evaluate dental needs to determine changes or trends in patterns of dental disease.
168,"analyze or interpret logistics data involving customer service, forecasting, procurement, manufacturing, inventory, transportation, or warehousing."
169,"analyze or manipulate bioinformatics data using software packages, statistical applications, or data mining techniques."
170,analyze or synthesize client data to draw conclusions or make recommendations for art therapy.
171,analyze or synthesize client data to draw conclusions or make recommendations for therapy.
172,"analyze organic or inorganic compounds to determine chemical or physical properties, composition, structure, relationships, or reactions, using chromatography, spectroscopy, or spectrophotometry techniques."
173,"analyze organizational, occupational, and industrial data to facilitate organizational functions and provide technical information to business, industry, and government."
174,"analyze originals to evaluate color density, gradation highlights, middle tones, and shadows, using densitometers and knowledge of light and color."
175,"analyze patient's medical history, medication allergies, physical condition, and examination results to verify operation's necessity and to determine best procedure."
176,analyze patrons' hair and other physical features to determine and recommend beauty treatment or suggest hair styles.
177,analyze patrons' requests to determine needed information and assist in furnishing or locating that information.
178,"analyze performance data to determine effectiveness of instructional systems, courses, or instructional materials."
179,analyze physical findings and medical histories to make diagnoses according to oriental medicine traditions.
180,analyze potential loan markets and develop referral networks to locate prospects for loans.
181,analyze potential loan markets to find opportunities to promote loans and financial services.
182,analyze prescribing trends to monitor patient compliance and to prevent excessive usage or harmful interactions.
183,"analyze price proposals, financial reports, and other data and information to determine reasonable prices."
184,analyze problems and take appropriate action to ensure continuous and reliable operation of equipment and systems.
185,analyze problems to develop solutions involving computer hardware and software.
186,analyze product complaints and make recommendations regarding their reportability.
187,"analyze recipes to assign prices to menu items, based on food, labor, and overhead costs."
188,"analyze records, reports, test results, or examination information to diagnose medical condition of patient."
189,"analyze regional energy markets, including energy pricing, market structures, energy generation competition, and energy transmission constraints."
190,"analyze research data to determine its significance, using computers."
191,analyze samples of biological material for chemical content or reaction.
192,"analyze samples, such as air or water samples, for contaminants or other elements."
193,analyze statistical data and reports to identify and determine causes of personnel problems and develop recommendations for improvement of organization's personnel policies and practices.
194,analyze survey objectives and specifications to prepare survey proposals or to direct others in survey proposal preparation.
195,analyze system performance or operational requirements.
196,analyze target companies or investment opportunities to inform investment decisions.
197,analyze technology trends to identify markets for future product development or to improve sales of existing products.
198,"analyze test data for automotive systems, subsystems, or component parts."
199,"analyze test data, making computations as necessary, to determine test results."
200,analyze test results and develop a treatment plan.
201,"analyze test results, machine error messages, or information obtained from operators to diagnose equipment problems."
202,analyze the effectiveness of marketing tactics or channels.
203,"analyze the financial details of past, present, and expected operations to identify development opportunities and areas where improvement is needed."
204,"analyze the financial impact of proposed logistics changes, such as routing, shipping modes, product volumes or mixes, or carriers."
205,"analyze the indications, contraindications, risk complications, and cost-benefit tradeoffs of therapeutic interventions."
206,"analyze the layout, instrumentation, or function of electrical generation or transmission facilities."
207,"analyze the probable outcomes of cases, using knowledge of legal precedents."
208,"analyze training needs to design employee development, language training and health and safety programs."
209,analyze training needs to develop new training programs or modify and improve existing programs.
210,"analyze trends in sales prices, construction costs, and rents, to assess property values or determine the accuracy of assessments."
211,analyze user needs and recommend appropriate hardware.
212,analyze user needs and software requirements to determine feasibility of design within time and cost constraints.
213,analyze user needs to determine technical requirements.
214,analyze x-rays to locate the sources of patients' difficulties and to rule out fractures or diseases as sources of problems.
215,"analyze, estimate, or report production costs."
216,"analyze, fabricate, or test fiber-optic links."
217,"analyze, interpret, or create graphical representations of energy data, using engineering software."
218,"analyze, interpret, or disseminate system performance data."
219,"announce musical selections, station breaks, commercials, or public service information, and accept requests from listening audience."
220,answer applicants' questions about benefits and claim procedures.
221,answer clients' questions about the purposes and details of financial plans and strategies.
222,"answer clients' questions regarding construction work, financing, maintenance, repairs, and appraisals."
223,"answer customer inquiries or explain cost, availability, policies, and procedures of facilities."
224,"answer customer questions related to energy sales procedures, energy markets, or alternative energy sources."
225,answer customers' questions about merchandise and advise customers on merchandise selection.
226,"answer customers' questions about products, prices, availability, or credit terms."
227,"answer customers' questions about products, prices, availability, product uses, and credit terms."
228,"answer customers' questions, and explain available services such as deposit accounts, bonds, and securities."
229,"answer customers' questions, and provide information on procedures or policies."
230,"answer inquiries from current or prospective customers regarding methods, materials, or price ranges."
